<?xml version="1.0" encoding="UTF-8"?>
<!DOCTYPE validation PUBLIC "-//Apache//TEXT Validation//EN" "http://purl.oclc.org/NET/turbine-review/Validation.dtd">

<validation requestLookupKey="action.StartProcess">
  <!--Validation Specification : action.StartProcess-->
  <parametervalidators>
    <parameter-validator name="action">
      <args />
      <validators>
        <validator class="org.apache.turbine.component.review.validators.AlwaysTrueValidator">
          <args />
        </validator>
      </validators>
    </parameter-validator>
    <parameter-validator name="template">
      <args />
      <validators>
        <validator class="org.apache.turbine.component.review.validators.AlwaysTrueValidator">
          <args />
        </validator>
      </validators>
    </parameter-validator>
    <parameter-validator name="processname">
      <args />
      <validators>
        <validator class="org.apache.turbine.component.review.validators.AlwaysTrueValidator">
          <args />
        </validator>
      </validators>
    </parameter-validator>
    <parameter-validator name="nocacheid">
      <args />
      <validators>
        <validator class="org.apache.turbine.component.review.validators.AlwaysTrueValidator">
          <args />
        </validator>
      </validators>
    </parameter-validator>
  </parametervalidators>
  <request-validator />
</validation>

