<?xml version="1.0" encoding="UTF-8"?>
<!DOCTYPE validation PUBLIC "-//Apache//TEXT Validation//EN" "http://purl.oclc.org/NET/turbine-review/Validation.dtd">

<validation requestLookupKey="action.formSample.SimpleFormSubmit">
  <!--Validation Specification : action.formSample_SimpleFormSubmit-->
  <parametervalidators>
    <parameter-validator name="action">
      <args />
      <validators>
        <validator class="org.apache.turbine.component.review.validators.AlwaysTrueValidator">
          <args />
        </validator>
      </validators>
    </parameter-validator>
    <parameter-validator name="passwordfield">
      <args />
      <validators>
        <validator class="org.apache.turbine.component.review.validators.AlwaysTrueValidator">
          <args />
        </validator>
      </validators>
    </parameter-validator>
    <parameter-validator name="textfield">
      <args />
      <validators>
        <validator class="com.anite.antelope.validation.FormMaxLengthValidator">
          <args>
            <argument name="maxlength" type="int" value="30" />
            <argument name="inputTooLongMessage" type="string" value="This item must be less than 30 characters in length. Please re-enter." />
          </args>
        </validator>
      </validators>
    </parameter-validator>
    <parameter-validator name="checkfield">
      <args />
      <validators>
        <validator class="org.apache.turbine.component.review.validators.AlwaysTrueValidator">
          <args />
        </validator>
      </validators>
    </parameter-validator>
  </parametervalidators>
  <request-validator>
    <args />
    <validators>
      <validator class="com.anite.antelope.validation.NotNullValidator">
        <args>
          <!-- Arguments for NotNullValidator -->
          <argument name="isNullMessage" type="string" value="Please enter a text value." />
          <argument name="keys" type="string" value="textfield" />
        </args>
      </validator>
      <validator class="com.anite.antelope.validation.NotNullValidator">
        <args>
          <!-- Arguments for NotNullValidator -->
          <argument name="isNullMessage" type="string" value="Please select a animal." />
          <argument name="keys" type="string" value="checkfield" />
        </args>
      </validator>
    </validators>
  </request-validator>
</validation>

