<?xml version="1.0" encoding="UTF-8"?>
<!DOCTYPE validation PUBLIC "-//Apache//TEXT Validation//EN" "http://purl.oclc.org/NET/turbine-review/Validation.dtd">

<validation requestLookupKey="action.myFirstWorkflow.HelloAction">
  <!--Validation Specification : action.myFirstWorkflow.HelloAction-->
  <parametervalidators>
    <parameter-validator name="action">
      <args />
      <validators>
        <validator class="org.apache.turbine.component.review.validators.AlwaysTrueValidator">
          <args />
        </validator>
      </validators>
    </parameter-validator>
    <parameter-validator name="pause">
      <args />
      <validators>
        <validator class="org.apache.turbine.component.review.validators.AlwaysTrueValidator">
          <args />
        </validator>
      </validators>
    </parameter-validator>
    <parameter-validator name="name">
      <args />
      <validators>
        <validator class="com.anite.antelope.validation.NotNullValidator">
          <args>
            <!-- Arguments for NotNullValidator -->
            <argument name="isNullMessage" type="string" value="Please enter a name." />
            <argument name="keys" type="string" value="name" />
          </args>
        </validator>
        <validator class="com.anite.antelope.validation.FormMaxLengthValidator">
          <args>
            <argument name="maxlength" type="int" value="60" />
            <argument name="inputTooLongMessage" type="string" value="This item must be less than 60 characters in length. Please re-enter." />
          </args>
        </validator>
      </validators>
    </parameter-validator>
    <parameter-validator name="done">
      <args />
      <validators>
        <validator class="org.apache.turbine.component.review.validators.AlwaysTrueValidator">
          <args />
        </validator>
      </validators>
    </parameter-validator>
  </parametervalidators>
  <request-validator />
</validation>

