<?xml version="1.0" encoding="UTF-8"?>
<!DOCTYPE validation PUBLIC "-//Apache//TEXT Validation//EN" "http://purl.oclc.org/NET/turbine-review/Validation.dtd">

<validation requestLookupKey="action.user.ChangePermission">
  <!--Validation Specification : action.user_ChangePermission-->
  <parametervalidators>
    <parameter-validator name="action">
      <args />
      <validators>
        <validator class="org.apache.turbine.component.review.validators.AlwaysTrueValidator">
          <args />
        </validator>
      </validators>
    </parameter-validator>
    <parameter-validator name="template">
      <args />
      <validators>
        <validator class="org.apache.turbine.component.review.validators.AlwaysTrueValidator">
          <args />
        </validator>
      </validators>
    </parameter-validator>
    <parameter-validator name="doaddgroup">
      <args />
      <validators>
        <validator class="org.apache.turbine.component.review.validators.AlwaysTrueValidator">
          <args />
        </validator>
      </validators>
    </parameter-validator>
    <parameter-validator name="doremovegroup">
      <args />
      <validators>
        <validator class="org.apache.turbine.component.review.validators.AlwaysTrueValidator">
          <args />
        </validator>
      </validators>
    </parameter-validator>
    <parameter-validator name="adduser">
      <args />
      <validators>
        <validator class="org.apache.turbine.component.review.validators.AlwaysTrueValidator">
          <args />
        </validator>
      </validators>
    </parameter-validator>
    <parameter-validator name="deleteuser">
      <args />
      <validators>
        <validator class="org.apache.turbine.component.review.validators.AlwaysTrueValidator">
          <args />
        </validator>
      </validators>
    </parameter-validator>
    <parameter-validator name="username">
      <args />
      <validators>
        <validator class="org.apache.turbine.component.review.validators.AlwaysTrueValidator">
          <args />
        </validator>
      </validators>
    </parameter-validator>
    <parameter-validator name="availablegroups">
      <args />
      <validators>
        <validator class="org.apache.turbine.component.review.validators.AlwaysTrueValidator">
          <args />
        </validator>
      </validators>
    </parameter-validator>
    <parameter-validator name="allocatedgroups">
      <args />
      <validators>
        <validator class="org.apache.turbine.component.review.validators.AlwaysTrueValidator">
          <args />
        </validator>
      </validators>
    </parameter-validator>
  </parametervalidators>
  <request-validator>
    <args />
    <validators>
      <validator class="com.anite.antelope.validation.NotNullValidator">
        <args>
          <!-- Arguments for NotNullValidator -->
          <argument name="isNullMessage" type="string" value="Please select a user." />
          <argument name="keys" type="string" value="username" />
        </args>
      </validator>
    </validators>
  </request-validator>
</validation>

